date,title,press,reporter,content,summary,sentiment
2021-02-19,청와대 “문 대통령 ‘백신 1호 접종’ 필요 아직 못 느껴”,hankyoreh,이완 기자 wani@hani.co.kr,"청와대는 문재인 대통령이 26일부터 시작되는 코로나19 아스트라제네카 백신 접종에서 가장 먼저 맞는 계획을 세우고 있지 않다고 밝혔다. 국민 다수가 백신 접종을 기피할 정도로 불안감이 팽배한 상황이 아니어서 대통령이 ‘선도 접종’에 나설 필요성이 아직 없다는 설명이다. 
청와대 관계자는 19일 <한겨레>와 한 통화에서 “요양병원과 요양원 의료진 가운데 대부분이 백신을 맞겠다고 신청했다. 이런 상황이면 굳이 대통령이 (불안감을 불식시키기 위해) 먼저 맞아야 할 필요성은 없는 것 같다”고 말했다. 
앞서 국민의힘 소속 유승민 전 의원은 이날 아침 자신의 페이스북에 “아스트라제네카, 대통령이 먼저 맞아야 불신을 없앨 수 있다”는 글을 올렸다. 유 전 의원은 “일부 의료진들이 (백신) 접종을 거부하는 사태가 발생하고 있다”며 “문재인 대통령은 1월18일 기자회견에서 ‘백신 불안감이 높아지면 먼저 맞는 것도 피하지 않겠다’고 했다. 그 말을 지킬 때가 왔다. 아스트라제네카 1번 접종을 대통령부터 하라”고 주장했다. 
문 대통령은 신년 기자회견에서 ‘백신 접종의 불안감을 해소하기 위해 가장 먼저 백신접종을 할 생각이 있는지’를 묻자, “한국 내에서 백신에 대한 불안 때문에 백신 접종을 기피할 것이라는 것은 아직은 기우라고 생각하고 있다”며 “백신 접종에 차질이 없다면 대통령을 비롯한 공무원들은 방역에 종사하는 공무원들을 제외하고 굳이 우선순위가 될 필요가 없다”고 말했다. 그러면서 “만약에 정말 백신에 대한 불안감이 아주 높아져서 백신을 기피하는 상황이 되고 뭔가 솔선수범이 필요한 상황이 된다면 그것도 피하지 않겠다”고 덧붙였다. 
이날 나온 여론조사 결과를 보면 코로나 백신 접종 의향이 꽤 높으면서도, 불안감도 잠재되어 있는 것으로 나타났다. 한국갤럽은 코로나19 백신 접종 의향을 물은 결과, 71%가 접종을 받겠다고 응답했다고 밝혔다. ‘접종을 받지 않을 것’이란 답변은 19%, ‘모르겠다’거나 응답을 거절한 비율은 10%였다. 다만 ‘백신 부작용이 있을까봐 걱정이 된다’는 물음에 71%가 ‘걱정된다’고 답했다. ‘걱정되지 않는다’는 응답은 26%였다. 이번 조사는 16~8일까지 전국 만 18살 이상 1000명을 대상으로 진행됐다. (신뢰수준 95%, 표본오차 ±3.1%, 자세한 내용은 한국갤럽 및 중앙선거여론조사심의위원회 누리집 참고)",청와대는 문재인 대통령이 26일부터 시작되는 코로나19 아스트라제네카 백신 접종에서 가장 먼저 맞는 계획을 세우고 있지 않다고 밝히며 국민 다수가 백신 접종을 기피할 정도로 불안감이 팽배한 상황이 아니어서 대통령이 ‘선도 접종’에 나설 필요성이 아직 없다는 설명이다.,0.039053679
2021-04-30,한-미 정상회담 21일 워싱턴서…대북정책·백신 등 논의 예정,hankyoreh,김지은 기자 mirae@hani.co.kr,"문재인 대통령과 조 바이든 미국 대통령이 오는 5월21일 워싱턴에서 한-미 정상회담을 한다고 청와대와 백악관이 30일 동시에 발표했다. 바이든 대통령 취임 석달 만에 열리는 것으로, 지난 16일(현지시각) 스가 요시히데 일본 총리에 이어 바이든 대통령이 외국 정상과 여는 두 번째 대면 정상회담이다.
청와대는 이날 “코로나19로 어려운 상황에서도 대면 정상회담이 조기에 개최되는 것은 한미동맹의 중요성을 잘 보여주는 것”이라며 이번 정상회담의 의미를 설명했다. 이어 이번 회담에서는 “한-미 동맹”과 “한반도의 완전한 비핵화 및 항구적 평화정착의 진전을 위한 한-미의 긴밀한 공조방안”을 비롯해 “경제통상 등 실질협력과 기후변화, 코로나19 등 글로벌 도전과제에 대한 대응협력”을 논의할 예정이라고 밝혔다. 
청와대 관계자는 구체적 회담 의제에 대해 “현재 논의 중”이라며 말을 아꼈지만, 무엇보다 북한·북핵 문제를 둘러싼 협의가 중점적으로 논의될 것으로 보인다. 다음달 초에 발표될 것으로 알려진 바이든 행정부의 새 대북정책을 바탕으로, 문 대통령은 북-미 간 대화 재개의 필요성과 함께 동시적·단계적 비핵화 접근 방식의 중요성을 강조할 가능성이 크다. 미국 쪽은 외교적 접근뿐 아니라 유엔안보리 대북결의 이행 필요성 및 북한 인권문제의 심각성 등을 강조할 수 있다. 앞서 바이든 대통령은 28일(현지시각) 북한·이란의 핵 위협을 거론하며 “동맹국들과 긴밀히 협력해 외교와 단호한 억지를 통해 대처할 것”이라고 말했다.
인도·태평양 지역 등에서의 한·미·일 협력 강화도 이번 회담의 주요 의제로 다뤄질 것으로 보인다. 바이든 정부는 취임 이후 기회가 있을 때마다 한·미·일 협력이 필수적이라고 강조했다. 지난 16일(현지시각) 미-일 정상회담에서도 인도·태평양 지역의 평화와 번영 및 북한 대응 등의 맥락에서 3국 협력이 “전례 없이 중요해졌다”는 인식을 함께 했다고 스가 총리가 전한 바 있다. 좀처럼 접점을 찾지 못하고 있는 한-일 관계 개선 논의도 빠질 수 없는 의제다. 
한-미 간 코로나19 대응 협력도 주요하게 다뤄질 것으로 보인다. 백신 수급과 관련해서는 최근 한국이 화이자와 2천만명분 추가공급 계약을 맺은 데다 미국이 다른 나라에 지원하겠다고 밝힌 아스트라제네카(6000만회분) 백신의 경우 인도 등 다급한 국가들과 협의를 시작한 것으로 알려져, 문 대통령이 적극적으로 요청하지 않을 것으로 알려졌다. 다만 정부의 백신 도입 계획에 차질이 생길 경우를 대비해 미국 정부와 백신을 필요할 때 빌려 쓰고 갚은 이른바 ‘스와프’ 관련 협의를 할 개연성이 크다.
이번 회담에서는 미-중 간 전략적 경쟁이 심화하는 가운데 미국의 대중 견제 전략을 둘러싼 협의도 이뤄질 전망이다. 청와대 관계자는 이날 한국의 ‘쿼드’(미국·일본·호주·인도가 참여하는 협의체) 참여 문제와 관련해 “쿼드 문제가 정상회담 의제로 정해졌다는 것은 전혀 사실이 아니다”라고 선을 그었다. 그러면서 “개방성·포용성·투명성 등 협력 원칙에 부합하고 국익과 지역·글로벌 평화에 기여한다면 어떤 협력도 가능하다”는 기존 입장을 반복했다. 회담에서는 중국과의 무역 갈등 속에서 바이든 정부가 집중하고 있는 반도체·배터리 글로벌 공급망 구축과 관련한 미국 쪽의 협력 요청도 예상된다. ","문재인 대통령과 조 바이든 미국 대통령이 오는 5월21일 워싱턴에서 “한-미 동맹”과 “한반도의 완전한 비핵화 및 항구적 평화정착의 진전을 위한 한-미의 긴밀한 공조방안”을 비롯해 “경제통상 등 실질협력과 기후변화, 코로나19 등 글로벌 도전과제에 대한 대응협력”을 논의할 예정이라고 청와대와 백악관이 30일 동시에 발표했다.",0.984738827
2021-03-03,"정부·여당, 코로나 백신 ‘가짜뉴스’ 전면전…허위정보 신속 삭제",hankyoreh,노현웅 기자 goloke@hani.co.kr,"코로나19 백신 접종이 시작된 가운데 정부·여당이 백신 안전성과 관련한 왜곡된 정보 유통을 차단하기 위해 팔을 걷었다. 정부가 3일 코로나19 백신과 관련한 ‘가짜뉴스’에 신속 대응하기 위한 협력 체계를 구축하기로 한 가운데, 더불어민주당은 백신 안전성에 의문을 제기하는 국민의힘을 강도 높게 비판했다.


이낙연 민주당 대표는 이날 오전 국회에서 열린 최고위원회의에서 전날 김종인 국민의힘 비상대책위원장의 발언을 문제 삼았다. 이 대표는 “야당 지도자들이 입에 올리기도 민망한 표현으로 정부를 비아냥하며 발목잡기를 계속하고 있다. 온 국민이 기다린 백신 접종마저 정쟁에 악용하는 모습”이라며 “혐오, 적대, 불신을 조장하는 부끄러운 행태에서 벗어나, 국민과 나라를 먼저 생각하는 품격과 책임 있는 정치를 해달라”고 촉구했다. 전날 김종인 국민의힘 비상대책위원장이 “아스트라제네카라는 유럽에서 매우 기피하는 백신이 우리나라에 들어와 접종되고 있다”고 언급한 것을 겨냥한 것이다.
김태년 원내대표도 “(어제 김종인 위원장 발언은) 제1야당 대표의 발언으로 믿기지 않는 저급한 유언비어”라며 “정치 공세에도 정도가 있다. 근거 없는 주장으로 불안과 공포를 조장하는 건 백신에 대한 국민의 수용성을 떨어뜨리는 매우 위험천만한 행동”이라고 가세했다. 그는 이어 “야당도 국민의 생명과 안전을 최우선시한다면 무책임한 언행을 자제해, 코로나 위기 극복 노력에 찬물을 끼얹지 않기 바란다”고 덧붙였다.
정부는 코로나19 백신 관련 ‘가짜뉴스’를 근절하기 위한 대응 체계 구축에 나섰다. 중앙재난안전대책본부(중대본)는 이날 질병관리청과 방송통신위원회를 중심으로 인터넷 포탈 등 플랫폼 사업자와의 협력 체계를 구축해 백신 관련 허위 정보를 신속히 삭제하는 등 대응에 나서겠다고 밝혔다. 유튜브와 소셜미디어 등을 통해 코로나19 관련 왜곡 정보가 유통될 경우, 질병청 또는 방통위가 해당 정보의 삭제·차단 등을 요청하고 사업자는 제재 수준 등을 검토해 조처에 나서겠다는 것이다.


각 시·도 경찰청도 전담요원을 두고 온라인에 유통되는 허위 정보를 모니터링하기로 했다. 방통위는 현재 운영 중인 ‘가짜뉴스 제보 게시판’을 통해 허위 정보 판별 및 후속 조처에 적극적으로 나선다는 방침이다. 
중대본은 이날 코로나19 백신 관련 가짜뉴스 사례로 △백신이 치매를 유발한다는 내용 △백신 접종 뒤 사지마비·경련, 심정지가 올 수 있다는 내용 △백신 접종을 거부할 경우 긴급 체포된다는 내용 △아스트라제네카 백신의 효능이 65살 이상에서 8%에 불과하다는 내용 △백신 접종을 통해 두뇌를 조종한다는 내용 등을 들었다.",코로나19 백신 접종이 시작된 가운데 정부·여당이 ‘가짜뉴스’를 근절하기 위한 대응 체계를 구축하기로 하면서 백신 관련 허위 정보를 신속히 삭제하는 등 대응에 나서겠다고 밝혔다.,0.119976871
2021-04-16,서욱 국방장관 코로나19 백신 접종,hankyoreh,길윤형 기자 charisma@hani.co.kr,"서욱 국방장관이 16일 오전 국군수도병원에서 코로나19 백신을 맞았다. 
서 장관은 이날 국군수도병원의 방역관리현황을 점검하고 “최근 코로나19 상황이 심상치 않은 조짐을 보이고 있는 만큼, 군 의료진들이 감염 예방과 현장대응, 백신접종 임무에 더욱 충실해 줄 것”을 당부했다.
서 장관은 이어 6월 초 미 하와이에서 열리는 존 아퀼리노 신임 미 인도·태평양 사령관 취임식 참석을 위해 아스트라제네카 백신 1차 접종을 마쳤다. 합참은 이 행사에 동행하는 원인철 합참의장도 함께 백신을 접종했다고 밝혔다. 
16일 오전 10시 현재 군내 코로나19 감염자는 689명이고 이 가운데 664명이 완치됐다.","서서욱 국방장관은 16일 오전 국군수도병원에서 코로나19 백신을 맞았으며 질병 예방과 현장대응, 백신접종 임무에 더욱 충실해 줄 것”을 강조했으며 이어 6월 초 미 하와이에서 열리는 존 아퀼리노 신임 미 인도·태평양 사령관 취임식 참석을 위해 아스트라제네카 백신 1차 접종을 했다고 밝혔다.",0.971055865
2021-02-26,"백신 접종 시작에도…야권 “우물쭈물하다 막차 탄 정부, 사과부터”",hankyoreh,김미나 김원철 기자 mina@hani.co.kr,"코로나19 백신 접종이 시작된 26일, 야권은 정부의 백신 늑장 도입을 비판하면서 정부가 목표로 세운 11월 집단면역 달성에 대해서도 부정적 관측을 내놓았다. 
 주호영 국민의힘 원내대표는 이날 오전 국회에서 열린 의원총회에서 이날 시작된 코로나19 백신 접종과 관련 “오이시디(OECD) 37개 국가 중 꼴찌로 백신 접종이 시작됐다”라며 “우물쭈물하다 백신 확보를 놓쳐 막차를 타고 이제 와서 겨우 시작한 데 대해 정부와 더불어민주당은 국민 앞에 먼저 사과부터 해야 할 것”이라고 목소리를 높였다. 주 원내대표는 이어 “정부와 민주당은 여전히 올해 11월까지 집단면역을 달성하겠다고 장밋빛 환상을 띄우지만, 전문기관들은 선진국도 내년 중반에나 집단면역에 도달할 것이라 내다본다. 정부여당의 무책임한 집단면역 호언장담이야말로 집단면역에 가장 큰 걸림돌이 될 것”이라고 날을 세웠다.
 배준영 당 대변인도 이날 오전 구두논평을 통해 “정부의 늑장대처로 인해 대한민국의 위상에 걸맞지 않은 전 세계 102번째 백신 접종국이라는 오명을 썼지만 그럼에도 불구하고 오늘 백신 접종의 시작이 코로나19 극복을 위한 첫걸음이 되기를 기대한다”고 밝혔다. 배 대변인은 그러면서 “오늘 백신 접종 시작을 계기로 정부는 국민들이 가장 궁금해하는 ‘안전한가. 나는 언제 맞을 수 있는가’에 대한 답을 하루속히 내놓을 수 있어야 할 것”이라고 지적했다. 
 서울시장 보궐선거에 나선 안철수 국민의당 대표는 이날 <와이티엔>(YTN) 라디오 프로그램에 출연해 “저를 비롯한 전문가들이 작년부터 겨울 대규모 확산과 백신 확보 등을 얘기했으나 (정부는) 대비하지 않다가 세계 100개국 이상이 접종을 하고 나서야 우리는 오늘부터 (접종)하는 것”이라며 “다음 (백신) 물량이 오기까지 한참 걸릴 것 같다. 생명은 물론이고 경제에도 악영향”이라고 우려했다.
 안 대표는 이어 “몇월에 어떤 종류의 백신이 얼마나 (국내에 들어)오고, 어떤 사람이 맞을 수 있는지, 내가 언제 맞을 수 있는지를 알려줘야 한다”며 “사이트를 만들어서 이름과 주민등록번호로 인증을 받으면 ‘당신은 몇월 며칠 접종 가능하다’로 알려주는 것이 필요하다”고 밝혔다.
 민주당은 26일 코로나 19 백신 접종이 시작된 것을 환영했다. 이낙연 민주당 대표는 이날 최고위원회의에서 “백신 접종이 일상 회복과 출발의 첫걸음이 되길 기대한다”며 “백신 유통부터 접종, 사후 반응 관찰까지 모든 과정에 걸쳐 빈틈없이 관리하겠다”고 말했다. 강선우 대변인도 서면 브리핑에서 “정부가 확보한 백신은 외부 전문가들의 3중 자문을 기반으로 전문성, 투명성, 그리고 철저한 검증을 통해 안전성이 검증된 백신”이라며 “정부를 믿고 백신 접종에 적극적으로 참여해달라”고 당부했다.
 정의당은 ‘백신 정쟁 중단’을 요구했다. 정호진 수석대변인은 논평에서 “백신 접종이 시작된 만큼 정치권은 불필요한 백신 정쟁을 멈춰야 한다”며 “방역당국은 백신접종의 사전·사후 관리 등 안전한 백신접종에 대해 만전을 기해달라”고 주문했다.
","외교로나19 백신 접종이 시작된 26일, 야권은 정부의 백신 늑장 도입을 비판하면서 정부가 목표로 세운 11월 집단면역 달성에 대해서도 부정적 관측을 내놓았는데, 미국을 예로 들면 정부는 백신을 접종 시작을 하면서 생명은 물론이고 경제에도 악영향을 끼치므로 백신 접종의 시작을 계기로 정부는 국민들이 가장 궁금해하는 ‘안전한가. 나는 언제 맞을 수 있는가’에 대한 답을 하루속히 내놓을 수 있어야 할 것이라고 지적한다.",0.204854682
2021-04-26,[리얼미터] 러시아 백신도입 필요 51.1%,hankyoreh,배지현 기자 beep@hani.co.kr,"국민 절반 이상이 러시아의 스푸트니크 브이(V) 백신 도입에 찬성한다는 여론조사 결과가 나왔다. 
 리얼미터가 26일 <와이티엔>(YTN)의 ‘더뉴스’ 의뢰로 지난 23일 전국 18세 이상 성인 500명을 대상으로 실시한 러시아 백신 도입 필요성 조사(표본오차 95% 신뢰수준±4.4%포인트) 결과, ‘필요하다’는 의견이 51.1%로 과반을 넘어섰다. 반면 도입이 필요하지 않다는 응답자는 38.3%였고, ‘잘 모르겠다’는 응답은 10.6%였다.  
 도입에 찬성하는 응답자 가운데 연령대별로 40대와 50대가 각각 57.2%와 57.8%로 우세했다. 다만 나머지 연령대인 △20대(필요 48.8%, 불필요 40.0%) △60대(필요 44.1%, 불필요 40.4%) △70세 이상(필요 43.9%, 불필요 39.3%) 등은 찬반 의견 모두 팽팽하게 대립했다. 지역별로도 인식 차가 났다. 호남과 피케이(PK·부산울산경남)에서는 ‘필요하다’는 응답이 각각 59.9%와 59.3%로 우세했지만 나머지 지역에서는 찬반이 대등하게 갈렸다. 이념별로는 진보 성향 65.6%가 러시아 백신 도입이 필요하다고 답했다. 
 문재인 대통령의 국정수행 부정 평가는 취임 뒤 최고치를 기록했다. 리얼미터가 지난 19~23일 전국 만 18세 이상 2352명을 대상으로 조사한 문재인 정부 국정수행 평가 조사(표본오차 95% 신뢰수준±1.9%포인트) 결과를 보면, 부정 평가가 지난주보다 1.5% 포인트 올라 63%로 집계됐다. 반면 긍정평가는 0.9% 감소해 33.8%로 하락했다. 정당 호감도는 국민의힘이 36.6%로 가장 높았고, 더불어민주당 30.7%, 국민의당 7.6%, 열린민주당 3.9% 순이었다. 자세한 내용은 리얼미터나 중앙선거여론조사심의위원회 누리집을 참조하면 된다. ","러시아의 리얼미터가 전국 성인 500명을 대상으로 러시아의 백신 도입 필요성 조사를 실시한 결과, 국민 절반 이상이 러시아의 스푸트니크 브이(V) 백신 도입에 찬성한다는 결과가 나왔다.",0.604539156
2021-04-16,백신난·민심악화 ‘발등의 불’…김부겸에 ‘소방수’ 중책,hankyoreh,이완 기자 wani@hani.co.kr,"문재인 정부의 사실상 마지막 국무총리로 지명된 김부겸 후보자의 어깨엔 역대 총리들보다 훨씬 무거운 과제가 놓여 있다. 초대 총리였던 이낙연 전 더불어민주당 대표는 박근혜 정권의 파행을 바로잡고 새 정부의 국정 운영 노선을 정하는 임무를 수행하면서, 새 정부 출범 초반의 압도적인 인기를 함께 누렸다. 바통을 이어받은 정세균 총리는 코로나19 대확산으로 피폐해진 민생난과 방역 문제 해결에 온힘을 쏟았다. ‘코로나 총리’로 불릴 만큼 고생을 했지만 동시에 ‘케이(K) 방역’ 성공의 공로를 인정받았다. 
하지만 김 후보자가 마주한 현실은 코로나 4차 대유행의 위협 속에서 해결되지 않는 백신 공급 문제, 누적된 방역 피로감, 4·7 보궐선거 패배로 확인된 민심 악화 등이다. 방역의 고삐를 죄고 백신 문제를 수습해 차기 대선까지 국정을 안정적으로 마무리하는 일이 시급하다. 지역갈등·불평등 완화, 사회통합과 함께 내각의 기강을 잡아 공정과 정의의 원칙을 세우는 일도 김 후보자에게 놓인 과제 중 하나다. 
김 후보자는 이날 오후 임시 사무실이 마련된 서울 종로구 금융감독연수원 앞에서 기자들을 만나 “더 낮은 자세로 국정을 쇄신하겠다”며 “성찰할 것은 성찰하고 혁신할 것은 혁신하겠다”고 말했다. 또 “문재인 정부의 성공적 마무리를 위해 혼신의 힘을 다하겠다”며 “남은 1년 기간에 가장 중요한 과제는 일자리와 경제, 민생”이라고 강조했다. 이어 “우리 국민들이 계획대로 백신을 접종할 수 있도록 정부의 역량을 총동원하겠다. 국민이 안심하고 하루 속히 일상을 회복하도록 하겠다”고 말했다. 또 “4·7 재보궐선거에서 나타난 국민의 질책에 대해 분명히 답을 하겠다""며 ""한국토지주택공사(LH) 투기사건 등에 대한 국민 여러분의 따가운 질책에 원칙을 세워 쇄신하겠다”고 거듭 강조했다. 그동안 잠시 언급조차 사라졌던 야당과의 협치 문제도 등장했다. 김 후보자는 “협치와 포용, 국민통합에 더 큰 노력을 기울이겠다. 야당에 협조 구하는 것을 주저하지 않겠다”고 했다. 
집권 막바지에 자칫 엇박자가 나기 쉬운 당·정·청을 매끄럽게 조율하는 가교 역할도 김 후보자에게 요구된다. 당장 정부의 사회적 거리두기 강화 조처로 피해를 입은 자영업자·소상공인의 손실을 소급해 보상할지를 놓고 당과 정부가 의견이 다르다. 과거 재난지원금 지급을 놓고 당과 정부가 강하게 충돌했던 사례가 재연될 가능성도 없지 않다. 
김 후보자의 장점은 40여년 동안 풍부한 정치 경험을 쌓았다는 것이다. 1977년 대학 시절 유신 반대 시위를 주도했고 1980년대 민주통일민중운동연합(민통련) 간사로 활동하며 재야 민주화운동을 벌였다. 한겨레민주당, ‘꼬마민주당’을 거쳐 1997년 대선을 앞두고 한나라당에 입당했다가 2000년 7월 열린우리당 창당에 동참했다. 2012년부터는 지역주의 타파를 목표로 고향인 대구로 내려가 관심을 모았다. 2012년 총선, 2014년 대구시장 선거에서 고배를 마셨지만 2016년 총선에선 62.03%의 압도적 득표율로 당선되며 31년 만에 민주당 깃발을 대구에 꽂았다. 문재인 정부 초대 행정자치부 장관을 지냈고 지난해 4월 총선에서 대구에서 낙선한 뒤 같은해 8월 민주당 당 대표에 도전했다가 이낙연 전 대표에게 패했다. 정치적 휴지기를 보내면서도 차기 총리 후보로 꾸준히 거론됐다. ",문재인 정부의 사실상 마지막 국무총리로 지명된 김부겸 후보자의 어깨에는 정부 출범 초반의 압도적인 인기를 누렸으나 스트레스와 민심 악화 등의 과제가 놓여 있으며 김연명 후보자는 “성찰할 것은 성찰하고 혁신할 것은 혁신하겠다”고 말했다.,0.981728375
