t_content,title,reporter,info
"4·7 서울시장 보궐선거에 출마한 더불어민주당 박영선 후보와 국민의힘 오세훈 후보가 5일 마지막 TV 토론에서 맞붙었다. 두 후보는 오 후보 처가의 내곡동 땅 논란과 현 정권의 부동산 정책 실패 등을 놓고 언쟁을 벌였다. 박 후보는 “거짓이 판치는 서울시를 만들지 않겠다”고 했고, 오 후보는 “서울부터 공정과 상생을 다시 세우겠다”고 했다. ◇”吳 거짓말 심판” “朴 존재가 거짓말” 이날 방송 토론에서도 박 후보는 오 후보 처가의 내곡동 땅 관련 의혹에 대한 공세를 펴고 “오 후보의 거짓말을 심판해달라”고 했다. 민주당과 박 후보는 오 후보가 2005년 처가의 서울 내곡동 땅 측량 현장에 왔다가 인근 생태탕 집에 들렀으며 서울시장 재임 기간 중 이 땅을 보금자리주택지구로 지정하는 데 관여했다고 주장하고 있다. 오 후보가 이날 토론에서 거듭 “그런 사실이 없다”고 부인하자, 박 후보는 “거짓말한 후보가 시장이 되면 아이들에게 뭘 가르치느냐. 거짓말쟁이”라고 했다. 그러자 오 후보는 민주당이 ‘당 소속 선출직 공직자가 잘못을 저질러 보궐선거를 치르게 될 경우 후보를 내지 않는다’고 했던 당헌·당규를 개정한 것을 언급하며 “박 후보의 존재 자체가 거짓말이다. 후보 안 내기로 해놓고 규정까지 바꿔서 나온 것 아니냐”고 했다. ◇”임대차 3법 방향 맞아” “정책 실패로 서민 피눈물” 두 후보는 현 정권의 부동산 정책을 두고도 공방을 벌였다. 오 후보는 박 후보가 문재인 정권의 부동산 정책이 잘못됐다고 했던 것을 언급하며 “임대차 3법은 안 고치느냐”고 물었다. 그러자 박 후보는 “정책 방향은 맞는다”며 “다만 개혁할 때 발생하는 일시적 부작용에 대해 국민께 호소해야 했는데 시기를 놓쳤다”고 했다. 오 후보는 “앞으로 2~3년간 전·월세 값이 계속 오를 텐데 법을 개정해야 하는 것 아니냐”고 했고, 박 후보는 “오 후보가 가진 자들의 입장을 대변해서 그렇다”고 했다. 정부의 공시가 인상 정책을 두고도 부딪쳤다. 오 후보는 “정부의 공시지가 급격 상향 조정에 서울시민 재산세가 급격히 올라가 피눈물을 흘리고 있다”고 했다. 그러자 박 후보는 “당과 조정해서 고치겠다”며 “그 일은 제가 할 수 있고, 오 후보는 할 수 없는 일”이라고 했다. 오 후보는 박 후보가 내놓은 ’21개 다핵 도시' 공약을 놓고 “서울에는 25자치구가 있는데, 다핵 도시는 21개”라며 “네 자치구는 어디가 빠지냐”고 했다. “지난번 토론에서는 예산이 5년간 4조원이 들어간다고 했는데, 매니페스토에는 1년에 4조원이 들어간다고 했다. 계산이 틀렸다”고도 했다. 이에 대해 박 후보는 “오 후보는 항상 계산이 틀리신다”며 “임대료 평균값도 모르시는 분 아니냐”고 했다. ◇”吳는 MB와 세트” “정권 교체가 시민들 명령” 박 후보는 “오 후보가 과거 광화문 집회에 나가 문재인 대통령을 독재자라고 한 적이 있는데 그래도 되는 거냐”고 했다. 그러자 오 후보는 “야당 얘기와 국민 의사를 무시하면 독재자 아닙니까”라고 했다. 박 후보가 “또 이런 집회에 나가 민생을 얼어붙게 만들 것이냐”고 하자, 오 후보는 “그 집회를 열게 만든 장본인이 누구인가. 문재인 정부가 시민들의 원성을 듣지 않아서 그런 것”이라며 “서울시장을 야권에서 탈환해 내년 정권 교체를 하라는 것이 시민들 무언의 명령”이라고 했다. 박 후보는 “MB 정권의 BBK 사건으로 국민들이 얼마나 아프고 분노했냐”며 오 후보를 향해 “MB와 세트”라고 했다. 오 후보는 “문재인 정권에 대한 기대가 실망으로, 분노로 바뀌었다”면서 “그 분노가 저에 대한 기대감으로 나타나고 있다. 반(反)미래, 반(反)청년의 정치를 용납하지 않겠다”고 했다.",박영선 “吳의 거짓말 심판을” 오세훈 “정권 교체는 시민 명령”,송혜진 기자,0.0979300701102537
"4·7 서울시장 보궐선거를 앞두고 더불어민주당 소속 서울시의원들이 서울시와 SH공사 등 서울시 산하 공기관에 오세훈 국민의힘 후보의 10여년 전 서울시장 재직 시절 관련 자료를 대거 요청하고 있다. 현재 서울시의회 의원 109명 중 101명이 민주당 소속이다. 시 안팎에서는 박영선 민주당 후보가 열세에 놓이자 같은 당 시의원들이 오 후보에 대한 저인망식 자료 수집을 통해 반격할 소재를 찾고 있다는 해석이 나온다. 29일 본지 취재를 종합하면 최근 10명 안팎의 민주당 소속 서울시의원들이 서울시와 SH공사, 도시기반시설본부 등에 2006~2011년 오 후보의 시장 재직 시절 관련 자료 등 40여건을 요청했다. 말이 40여건이지, ‘관련 자료 일체' ‘모든 공문' 등의 방식으로 문서를 요구한 경우가 많아 해당 부서와 공기관들이 자료 준비에 골머리를 앓고 있는 것으로 알려졌다. 여당 시의원들 요구가 집중되는 곳은 ‘오 후보 내곡동 땅 의혹’ 관련 자료이다. 모두 20여건에 달하는 것으로 알려졌다. ‘보금자리주택지구 지정과 보상 관련 국토부·서울시·서초구와 주고받은 공문’ ’2007년 7월 서울시장이 서초구청과 내곡지구를 시찰하는 모든 사진' 등의 자료 요청이 이어지고 있다. ‘오 시장 재직 시절 모든 업무보고 자료’를 요구한 경우도 있었다. 오 후보 시장 재직 당시 만든 동대문디자인플라자(DDP)나 세빛섬, 광화문광장 등도 타깃이다. 한 시의원은 ‘DDP 만들 때 문화재 보존·관리와 관련해 문화재청과 주고받은 공문’도 요구했다. DDP를 만들 때 문화재가 발굴됐는데 DDP를 짓느라 발굴을 못 했다는 의혹이 일각에서 제기된 것과 관련된 것으로 보인다. 오 후보 시장 재직 시절 홍보비·업무추진비 사용 내역과 관용차 사용 내역, 관사 운영비를 얼마 썼는지도 제출하라고 요구한 민주당 시의원도 있다. 익명을 요구한 서울시 관계자는 “이런 자료 요청은 시장 선거 때마다 여야를 가리지 않고 벌어지는 일”이라면서도 “민주당이 열세일수록 민주당 시의원들 요구는 더 늘어날 것 같다”고 말했다.",與 서울시의원들 “오세훈 시장때 자료·공문 다 내놔라”,정한국 기자,0.21925997212905107
"국민의힘 오세훈 후보의 구두를 놓고 정치권 논쟁이 점입가경으로 치닫고 있다. 문제의 생태탕집과 더불어민주당 박영선 서울시장 후보는 오 후보가 2005년 내곡동 땅 측량에 참여했고 당시 신었던 신발이 ‘페라가모’라고 주장하고 있다. 그 근거라며 제시한 2006년 사진에 대해 오 후보 측은 “국산 브랜드”라고 반박하고 있다. 급기야 “사진에 나타난 신발은 페라가모가 아니라 구찌”라는 주장까지 추가로 제기됐다. 박영선 후보는 4·7 재보궐선거 하루 전인 6일 BBS라디오 ‘박경수의 아침저널’에 출연, “오 후보가 신었다는 페라가모 로퍼 신발 사진을 찾기 위해서 네티즌들이 총출동을 했던데, 드디어 사진 한 장을 어떤 분이 찾아서 올렸더라”면서 “2006년 9월 21일 동대문서울패션센터 개관식 참석 사진을 보면 오 후보가 그 페레가모 신발을 신고 있다”고 말했다. 이어 “오죽하면 네티즌들이 이렇게까지 하겠나”라고 했다. 박 후보가 언급한 ‘오세훈 페라가모’ 사진은 전날부터 친여 성향 인터넷 커뮤니티에서 확산하고 있다. 한 네티즌이 “오 후보가 2006년 9월 21일 동대문 서울패션센터 개관식에 참석한 사진을 찾았다”면서 서울 중구 지역언론 ‘중구자치신문’에 실린 사진을 올린 것이다. 이 네티즌은 “내곡동 토지 측량이 2005년에 이루어졌으니까 시간적으로도 근접한 것 같다”고 했다. 생태탕집 아들 A씨도 지난 4일 한겨레신문 인터뷰에서 “키 크고 멀쩡한 분이 하얀 로퍼 신발을 신고 내려오는 장면이 생각나서 ‘오세훈인가 보다’했는데, 어머니한테 물어보니 ‘맞는다’고 했다”고 했다. A씨는 해당 신발 브랜드에 대해 일관적으로 ‘페라가모’라고 주장하고 있다. 다만 한겨레신문은 A씨가 해당 신발이 흰색이라고 증언한 것이 사진에 나타난 검정색 구두와 일치하지 않는다는 지적에 “기자가 잘못 들었다”며 정정·사과보도문을 냈다. 오 후보 측은 사진 속 신발에 대해 “페라가모 브랜드가 아니다”라는 입장이다. 오 후보 측 관계자는 “페라가모와 비슷한 국산 브랜드”라며 “국산 브랜드 중에도 페라가모 비슷하게 따라 만든 것이 많다”고 했다. 오 후보가 신었던 구두는 신발 중심 부위에 금속 장식(버클)이 달렸는데, 이런 스타일은 2000년대 중반 유행하던 것으로 모방 제품이 많았다고 패션계에선 지적하고 있다. 해당 제품이 페라가모인지 또는 국산인지를 놓고 공방이 뜨거워지는 가운데 오 후보가 신었던 신발은 페라가모도 국산도 아닌 ‘구찌’라는 제3의 주장도 제기됐다. 새누리당(국민의힘 전신) 전여옥 전 의원은 이날 자신의 블로그에서 “이 구두가 페라가모가 아니고 구찌라고 한다”라며 “박영선은 결국 누구냐, ‘페라가모 호소인’이었다”고 썼다. 패션계 관계자는 “페라가모의 말발굽 장식, 구찌 말 재갈 장식이 유사한 데다 오 후보 구두 사진이 흐릿해 정확하게 판별하기가 쉽지 않은 상황”이라고 했다.","오세훈 구두 국산이다, 구찌다...‘페라가모 호소인’까지 등장",원선우 기자,0.16097360083806148
"국민의힘 오세훈(60) 후보가 23일 국민의당 안철수 후보를 이기고 4·7 서울시장 보궐선거의 범야권 단일후보로 선출됐다. 오 후보는 지난 22일 하루동안 100% 휴대전화를 활용해 서울시민 3200명을 조사한 여론조사에서 안 후보를 앞섰다. 양당은 선거관리위원회 규정에 따라 구체적인 여론조사 결과는 공개하지 않기로 했다. 이번 여론조사는 한국리서치와 글로벌 리서치 2개기관에서 각각 1600명(800명 경쟁력, 800명 적합도 조사)씩 모두 3200명을 조사했다. 오 후보 캠프 측은 발표 직후 “오세훈 후보를 선택해주신 서울시민께 진심으로 머리 숙여 감사드린다. 이제 우리 야권은 오세훈 후보를 중심으로 보궐선거 승리라는 고지를 향해 나아갈 것”이라고 밝혔다. 오 후보는 단일화 협상 발표 직후, 국회에서 기자회견을 열고 “분노와 절망속에서도 희망을 선택해주신 여러분들의 마음을 겸허히 받들겠다. 다시 한번 머리 숙여 감사드린다”고 했다. 오 후보는 또한 “안철수 후보님께도 위로와 감사의 말씀을 드린다”며 “우리는 단일화 전투에서는 대결했지만 정권 심판의 전쟁에서는 저의 손을 꼭 잡아달라. 절박하고 처절하게 승리를 위해서 함께 최선을 다하자”고 했다. 국민의힘 김종인 비상대책위원장도 여론조사 결과 발표 직후 “오세훈 후보를 지지해준 서울시민 여러분들에게 감사말씀 드린다”며 “우리 제1야당의 오세훈 후보가 그동안 우여곡절이 있었지만, 그가 후보 단일화로 되는 것이 상식이라 봤다. 정치에 상식이 통했다는 것을 이번 서울시민이 입증해준 것에 감사드린다”고 했다. 오세훈, 19일의 반전(反轉) 오 후보가 안 후보를 누르고 단일후보로 선출된 건 ’19일의 반전(反轉)’으로 기억될만 하다. 오 후보는 처음 국민의힘 서울시장 보궐선거 예비후보 경선에 나올 때도 안 후보에게 “안 후보가 국민의힘에 입당하면 저는 출마하지 않겠다”며 이른바 ‘조건부 출마 선언'을 했다. 당시 안 후보의 지지율이 국민의힘 예비후보들보다 높았고, 당내에서도 ‘안 후보를 중심으로 단일화를 진행하자'는 목소리가 적지 않게 나오는 상황이었다. 안 후보가 입당·합당 거절을 하면서, 오 후보는 이후 국민의힘 경선에 출마했지만, 당원 20% 일반시민 80%로 치러진 1차 컷오프에서는 나경원 전 의원에게 다소 뒤지는 상황이었다. 지난 4일 시민여론조사 100%로 치러진 최종 경선에서 승리할 때도 따라서 ‘이변’이란 말을 들었다.국민의힘 관계자는 “중도를 향한 야권 지지층의 지향이 반영된 것”이라고 했다. 오 후보는 이후 안 후보와 단일화 협상을 나섰다. 단일화 협상 과정이 순탄치만은 않았다. 여론조사 방법과 시기, 문항 등을 놓고 양당이 갈등을 빚으면서 단일화가 무산되는 것 아니냐는 우려도 많았다. 각종 여론조사에서도 초반에는 오 후보가 안 후보에게 다소 열세였다. 그러나 제1야당 국민의힘 쪽으로 여론과 세(勢)가 결집하면서 오 후보는 상승세를 보였다. 국민의힘 후보지만 상대적으로 중도에 가깝고, 젊은층과 무당층에게도 확장성이 있음을 내세운 것도 안 후보와의 경쟁에 주효했다. 지난 20일 오 후보가 유선전화 포함을 양보했고, 오 후보가 주장했던 ‘적합도’와 안 후보가 요구했던 ‘경쟁력’을 절충하면서 단일화 협상은 극적으로 타결됐다. 10년만에 도전하는 세번째 서울시장 선거 오 후보는 이제 민주당 박영선 후보와 맞붙는다. 오 후보로선 10년만에 세번째로 도전하는 서울시장 선거다. 2006년 서울시장 선거에 이어, 2010년 서울시장 재선에 성공했다. 시장으로 일하면서 이라크 출신의 세계적인 건축가 자하 하디드가 설계한 동대문디자인플라자(DDP)로 대표되는 ‘디자인 서울’, 세빛둥둥섬으로 기억되는 ‘한강 르네상스 프로젝트’ 등을 펼쳤다. 2011년 8월 민주통합당의 전면적 무상급식 추진에 반대하며 시장직을 걸고 주민투표를 실시했으나, 유효 투표율 미달로 무효가 되자 사퇴했다. 오 후보가 시장직에 하차하고, 당시 무소속이었던 박원순이 서울시장 당선돼 10년 동안 서울 시장을 지냈다. 오 후보는 이에 여러 차례 “지난 10년 동안 많이 죄송했다”며 “박원순 10년 시정의 원죄(原罪)를 용서받을 수 있는 날을 준비해왔다”고 했다. 최근까지 발표된 각종 여론조사의 가상 양자 대결에서 오 후보는 민주당 박 후보를 앞서고 있다. 다만 여전히 누구에게 투표할지 결정하지 못한 무당층이 적지 않아 투표일까지 결과를 알 수 없다는 관측이 많다.","오세훈, 10년만에 시장 세번째 도전... “정권심판 전쟁 시작”",송혜진 기자,0.741917175348187
"국민의힘 오세훈 서울시장 후보가 31일 “1가구 1주택의 경우 소득 없는 분들에게는 재산세를 면제해드리는 게 옳다고 생각한다”고 밝혔다. 오 후보는 공시가격 동결과 세율 인하 등도 공약했다. 오 후보는 이날 오전 관훈클럽 초청 토론회에서 “노후 대책으로 집 한 채 마련했는데 소득이 없어서 집을 팔아야 하는 것은 너무 가혹하다”라며 “서울 아파트 중위 가격이 9억5000만원을 넘어섰는데 재산세 납부 기준을 6억에서 9억원으로 모두 옮기는게 바람직하다”라고 했다. 오 후보는 “공시 가격이 급등했으니 세율을 낮추는게 맞다”며 정부에 건의하겠다고 밝혔다. 또 “공시가격을 급격히 올린 데 따른 경제적 불이익은 반드시 원위치시켜야 한다”고 했다. 이달 서울 지역 아파트 공시지가 인상으로 강남·북을 가리지 않고 곳곳에서 민원과 이의 제기가 잇따르고 있는 상황이다. 오 후보는 공시가 인상 관련 “재산세, 종부세 뿐 아니라 건보료를 포함해 62가지 준조세의 처리 기준이 된다. 한마디로 재산상의 손해가 엄청나다”라고 했다. 오 후보는 문재인 정부의 부동산 정책이 실패했다고 규정하며 “재개발·재건축 정상화로 18만5000호를 공급하겠다”고 밝혔다. 기존 공급계획(7만5000호)에 상생주택 7만호, 모아주택 3만호 등을 공약했다. 그는 “경험이 있고 비전이 있다. 서울시민을 위한 열정과 의지가 있다”라며 “대한민국의 심장인 서울을 도시경쟁력 세계 1위로 반드시 만들 것”이라고 했다. 오 후보는 처가의 서울 내곡동 땅 의혹 관련 “존재 자체를 몰랐다”는 과거 발언에 대해 “그 표현이 빌미가 된 것 같다. 반성한다”라고 했다. 그러면서 “(KBS 보도를 보고) 처음에는 분노했지만 기억을 못하거나 흐려졌나 (생각했다)”라며 “기억이라는 건 대화에서 반복하거나 언급하면 강화되거나 유지된다. 그 뒤로 한번도 이야기 안 하면 5~6년만 지나도 전혀 못 하는 게 인간의 기억력”이라고 했다. 오 후보는 “이 문제가 제기되면서 처가가 패닉, 거의 초토화 상태”라며 “너무 혼란스러워서 미안해하고 서로 지은 죄도 없으면서 서로 미안해하는 거다. 집에 가면 아내가 눈치 보고 저도 아내 눈치를 본다”라고 했다.","오세훈 “내곡동 몰랐단 표현 반성, 처갓집은 초토화”",김은중 기자,0.2817033414958132
"국민의힘 김종인 비상대책위원장은 23일 오세훈 후보가 야권 단일화 후보로 결정되고 “오 후보가 선출됐으니 제가 국민의힘에 와서 할 일의 90%는 다했다고 생각한다. 나머지 10%는 오 후보를 서울시장에 당선시키는 것”이라고 했다. 김 위원장은 이날 취재진들과 만나 “오 후보를 지지해준 서울시민 여러분에게 감사 말씀을 드린다.결과가 잘 나와서 무엇보다 다행”이라며 이같이 말했다. 김 위원장은 “안 후보는 3개월전부터 야권 단일 후보가 되겠다고 나선 반면, 우리 당은 지난 4일부터 단일화 협상을 시작했기 때문에 상대적으로 시민에게 노출될 기반이 짧았다”며 “그럼에도 결국 우리 당의 힘이 기반이 돼서 오 후보로 결정됐다”고 했다. 오세훈 후보가 단일후보로 선출되기까지 제1야당의 조직력이 도움이 됐다는 취지였다. 김 위원장은 안철수 후보에게는 “그동안 야권의 흥행을 위해 여러가지 노력을 해온 것에 감사하게 생각한다”며 “서울시장 선거를 위해 열심히 돕겠다고 했던 말을 지켜주길 기대한다”고 했다. 안 후보와의 합당 여부에 대해서는 “지금은 합당 문제를 얘기할수 없다. 선거 승리 후에 국민의힘 중심으로 해서 야권 개편을 할 때 국민의당이 어떤 행동을 할 것인지 결정할 것”이라고 했다.",김종인 “오세훈 단일후보 됐으니 내가 할 일의 90%는 했다”,송혜진 기자,0.6468657411329332
"4·7 서울시장 보궐선거에 출마한 더불어민주당 박영선, 국민의힘 오세훈 후보는 29일 첫 TV 토론에서 오 후보의 서울 내곡동 처가 땅 문제를 놓고 충돌했다. 박 후보는 “오 후보가 내곡동 땅 측량 현장에 가지 않았다는 것은 거짓말”이라고 했고, 오 후보는 “현장에 안 갔다”며 “목격자라고 주장하는 분들은 수사기관에서 만날 것”이라고 했다. 박 후보는 이날 MBC 토론회 초반부터 내곡동 땅 문제를 놓고 오 후보를 집중 공격했다. 박 후보는 “오 후보 처가는 36억5000만원 토지 보상금 이외 추가로 받은 게 있느냐”고 했고 오 후보는 “없다. 장인·장모님이 받았는데 제가 어떻게 알겠느냐”고 했다. 이에 박 후보는 “서울주택토지공사(SH) 답변서를 보니 보상금 이외에도 단독주택 용지를 특별분양 받았다”고 했다. 그러자 오 후보는 “처가 재산을 제가 정확히 알겠느냐”고 했다. 오 후보는 박 후보가 측량 현장 참석 여부를 집중 추궁하자 “16년 전 일을 정확히 기억 못해서 제가 여지를 두지만, ‘삼인성호(三人成虎·거짓도 여러 사람이 얘기하면 주변을 속일 수 있다는 뜻)’라는 옛말이 있다”며 “기억 앞에 겸손하겠다”고 했다. 그러면서 “본질은 다 어디로 가고 측량하는 데 갔느냐 안 갔느냐로 초점을 옮겨간다”고 했다. 그는 “초점은 조상으로부터 물려받은 땅이었고, LH 사태처럼 보상을 받으려고 땅을 산 게 아니며, 제가 관여해서 더 보상받도록 영향력을 행사한 적이 없다는 것”이라며 “세 가지 거짓말을 민주당이 시작했는데, 이것을 입증하지 못했다”고 했다. 오 후보는 박 후보의 ‘1인당 재난지원금 10만원 지급’ 공약을 공격했다. 오 후보가 “1조원 재원을 마련할 자신 있느냐”고 하자 박 후보는 “서울시 결산 잉여금 1조3500억원이 있다”며 “그 중 1조를 소상공인·자영업자에게 디지털 화폐로 지급하겠다”고 했다. 오 후보가 “공보물을 보니 공약이 100개가 넘는데 얼마나 들어가느냐”고 하자 박 후보는 “5년간 4조원이 들어간다”고 했다. 이에 오 후보는 “박영선 후보의 1년 예산 재원을 계산해보니 재난지원금 1조원, 반값 아파트 6조원 등 연간 15조원이 들어간다”고 했다. 그러자 박 후보는 “계산이 엉터리로 됐다”고 반박했다. 오 후보는 천안함 폭침과 관련, 박 후보가 과거 음모론 등에 동조한 것을 겨냥, “그땐 왜 다른 이유를 댔냐”고 했다. 이에 박 후보는 “합참에서 그런 데이터를 비공개로 제공했다”고 했다. 박 후보는 “더불어민주당 성추행 당헌개정 투표에 참여했느냐”는 오 후보 질문에 “당시 중소벤처기업부 장관이어서 제 기억엔 투표 안 했다”고 했다. “개정 결론이 나도록 내버려둔 것 아니냐”고 오 후보가 추궁하자, 박 후보는 “당 일을 하지 않았다. 함부로 규정하지 말라”고 했다.",박영선 “吳 내곡동 땅 거짓말” 오세훈 “朴 천안함 때 왜 그랬나”,원선우 기자,0.10790888913375273
