t_content,title,reporter,info
"국민의힘 오세훈 후보가 23일 4·7 서울시장 보궐선거의 야권 단일 후보로 선출되면서 여야는 14일에 걸친 선거전에 들어갔다. 더불어민주당 박영선 후보 측은 이날 “오 후보는 ‘MB(이명박 전 대통령) 아바타’이자 낡고 실패한 시장”이라며 “서울의 미래 박영선을 선택해달라”고 했다. 이에 맞서 오 후보는 “야권 후보 단일화는 문재인 정권을 심판하고 정권 교체의 길을 열라는 시민의 준엄한 명령”이라며 서울시장을 탈환하겠다고 했다. 국민의힘 오세훈 후보는 23일 야권 단일 후보로 선출되자 “무능하고 무도한 정권을 심판하는 데 제가 앞장서겠다”고 했다. 그는 이날 국회에서 기자회견을 열고 “민주당은 시민의 뜨거운 분노마저 두려워하지 않는 무능하고도 오만방자한 당이다. 단일화로 정권을 심판하고 정권 교체의 길을 활짝 열겠다”고 했다. 이번 선거를 ‘정권 심판’, 나아가 ‘정권 교체’를 위한 교두보로 삼겠다는 취지다. 오 후보는 정권 심판론을 부각하기 위해 최근 ‘LH 사태’와 고(故) 박원순 전 서울시장의 성추행 피해자 사건 등을 집중적으로 언급해왔다. 그는 이날 라디오 인터뷰에서도 ”민주당 박영선 후보 캠프에서 ‘피해 호소인’ 3인방을 측근으로 기용해 선거를 시작한 모습을 보고 많은 분들이 분노하고 실망했다”고 했다. 고민정·진선미·남인순 의원이 박 후보 캠프에서 사퇴한 것에 대해선 “사퇴가 아니라 전략적 손절”이라며 “정말 피해자의 상처가 치유되길 원한다면 박 후보가 사퇴해야 한다”고 했다. 오 후보 캠프에선 ‘민폐(민주당의 적폐)’라는 단어를 앞세워 캠페인을 시작했다. ‘LH 사태’를 겨냥한 전략이다. 이들은 “민폐 청산 1호 대상은 민주당의 부동산 적폐”라고 했다. 33·34대 서울시장을 지낸 경험도 강조한다. 오 후보 캠프에선 ‘첫날부터 능숙하게’라는 구호를 내세우고 있다. 오 후보는 이날도 “능력과 경험이 검증된 후보를 성원해달라”고 했다. 자신이 2011년 무상급식 반대를 주장하며 서울시장직을 사퇴했던 것에 대해선 “시민 여러분께 진 마음의 빚을 일로써 갚을 수 있는 날을 고대한다”며 눈시울을 붉히기도 했다. 그는 “가슴 한 켠에 자리한 무거운 돌덩이를 이제 조금은 걷어내고 다시 뛰는 서울시로 보답하겠다”고 했다. 민주당 박 후보가 오 후보의 내곡동 땅 보상 문제를 거론하는 것에 맞서, 오 후보는 박 후보의 일본 아파트 문제를 꺼내 들었다. 특히 박 후보가 지난 2월에 아파트를 처분했다고 주장했던 것과 달리, 아직 등기부등본상 박 후보의 남편 이름으로 돼 있다는 사실을 언급했다. 오 후보는 22일 “박 후보가 지난 2월에 아파트를 처분했다고 주장하고 있지만, 등본 확인 결과 그렇지 않은 것 같다”며 “매각 중이라면 이를 증명할 수 있는 매매 계약서를 공개하라”고 했다. 오 후보는 내곡동 땅은 특혜 보상이 아니라 강제 수용됐다는 입장이다. 박 후보가 자신을 “이명박 전 대통령(MB) 같다”고 말한 것에 대해선 “괴벨스 같다”는 말로 맞섰다. 박 후보를 나치 정권의 선전 장관에 빗댄 것이다. 오 후보는 이날도 박 후보와 민주당을 겨냥해 “저들은 조직선거, 흑색선전 선거, 인기영합주의 선거의 삼각파도를 세차게 몰아오고 있다”며 “저는 그 역사를 거스르는 파도를 반드시 넘어 물거품으로 만들겠다”고 했다. 국민의당 안철수 대표와 단일화 효과를 극대화하는 전략도 고심 중이다. 25일부터 시작되는 선거운동에서 두 후보가 ‘화학적 단일화’를 이뤄낸 모습을 보여주는 것이 중요하다는 판단에서다. 오 후보는 이날 안 대표를 향해 “우리는 단일화 전투에서는 대결했지만 정권 심판의 전쟁에서는 손을 꼭 잡아 달라”고 했다. 오 후보가 안 대표에게 서울시를 공동 운영하자고 먼저 제안했던 것도 단일화 이후에 서로 교류하는 모습을 보여주기 위해 구상한 정책이라는 해석이 나오고 있다. 그는 “서울시 공동 운영을 위한 정책팀을 조만간 꾸리고 안 대표와 이야기를 나눠 발표하겠다”고 했다.",오세훈 “LH투기·성추행 민폐 청산”,송혜진 기자,0.405111588597661
"4·7 서울시장 보궐선거에 출마한 국민의힘 오세훈 후보 캠프는 22일 내곡동 땅의 ‘셀프 보상’ 의혹에 대해 “내곡지구는 노무현 정부에서 허가한 사항임을 확인할 수 있는 문건을 입수했다”며 “해당 토지는 노무현 정부 최초 계획 때부터 계획범위에 포함돼 있었다”고 주장했다. 오 후보 캠프 측은 이날 성명을 내고, “2007년 3월에 작성된 중앙도시계획위원회 심의 안건을 보면, 당시 서울내곡지구로 요약되는 개발제한구역을 국민임대주택단지로 추진하기 위해 정부가 국책사업으로 심의·의결한 것을 알 수 있다”고 했다. 오 후보 캠프 측은 “이는 노무현 정부가 내곡동 지구를 국민임대지구로 지정하기 위해 공식 절차를 밟았음을 확인시켜주는 문건”이라며 “특히 추진경위를 보면 2006년 3월에 내곡단지를 예정지구로 지정 제안했고, 2007년 2월과 3월에 중앙도시계획위원회 심의를 거쳐 3월22일 이 국책사업안을 최종통과시켰음을 알 수 있다”고 주장했다. 오 후보 캠프 측은 “이듬해 국민임대주택법이 보금자리주택법으로 모법이 바뀌면서 행정절차가 이행됐다는 것이 진실”이라며 “박영선 후보 캠프의 요란하고 실체도 없는 흑색선전이 덮을 수 없는 본질도 이것”이라고 했다. 오 후보 캠프 측은 또한 “아무리 ‘오세훈 셀프 지정’이라고 주장하고 싶은들, ‘노무현 정부 셀프 지정’임을 국민들이 알게 된 것”이라며 “설마 노무현 정부에서 오세훈 후보에게 특혜를 주기 위해 지구지정을 추진했겠느냐. 박영선 후보 캠프는 세계 물의 날 기념으로 냉수 한 잔 드시고 이성을 회복하라”고 했다. 해당 문건을 국토부로부터 입수한 국민의힘 김은혜 의원은 “지난 10년간 박원순 시장과 문재인 정권은 단 한마디 아무 말이 없다가 선거가 불리한듯 하니 허위와 흑색선전 광풍으로 진실을 덮으려 하고 있다”며 “해당 문건으로 그동안의 모든 허위와 모함의 논란을 종결지을 것”이라고 밝혔다.","오세훈 “내곡지구, 盧정부 허가였음 보여주는 문건 있다”",송혜진 기자,0.08194875733397566
"김태년 더불어민주당 당대표 직무대행이 28일 문재인 대통령을 향해 ‘중증 치매 환자’라는 표현을 쓴 오세훈 국민의힘 서울시장 후보에 대해 “극우 정치인”이라고 비판했다. 이에 야당은 “민주당의 그 많은 막말 정치인도 극우인가”라고 맞받았다. 김 대표대행은 이날 페이스북에 오 후보의 ‘중증 치매 환자’ 표현을 거론하며 “태극기 부대와 손잡은 오세훈 후보가 연일 극우 본색을 유감없이 드러내고 있다”고 했다. 그러면서 “오 후보가 극우 정치인이라는 것”이라며 “극우 정치인의 특징은 보편과 상식을 벗어난 극단적 행동과 폭력이며 그것을 신념화한다”고 했다. 김 대표대행은 “10년 전 무상급식 반대 중도사퇴도 보편과 상식에 반하는 오 후보의 신념이 만들어 낸 촌극”이라며 “원래 뼛속까지 극우인 분이 합리적 보수인 척 위장하는 것은 국민을 속이는 불편한 기만”이라고 했다. 이어 “극우 정치인이 공직까지 맡아서는 안 된다”며 “오 후보가 서울시장이 되는 순간 광화문 광장은 태극기 부대의 난동으로 가득 채워질 것”이라고 했다. 이에 국민의힘 김근식 비전전략실장은 이날 오후 페이스북에 “헛소리 네거티브로도 승산이 없으니까 이제 무차별 비난을 쏟아낸다”고 했다. 김 실장은 “2019년 조국사태로 온 국민의 분노가 극에 달하던 시점에 개천절 광화문 집회에서 오 후보가 ‘치매환자’ 발언했다는 이유로 극우정치인이면, 민주당의 그 많은 막말 정치인도 극우인가”라고 했다. 김 실장은 “오 후보를 쓰레기라고 비난하는 민주당 윤호중 의원도 극우인가”라며 “아무리 선거라지만 적당히 하시지요. 좀스럽고 민망하다”고 했다. 오세훈 후보는 2019년 전광훈 목사가 주최한 집회에서 문재인 대통령을 향해 ‘중증 치매 환자’ ‘독재자’라고 언급했다. 오 후보는 최근 유세 현장에서 민주당 측 공세에 “야당이 그 정도 말도 못하냐”고 했다. 윤호중 민주당 의원은 박영선 민주당 후보 지원 유세에서 오 후보의 내곡동 의혹과 관련, “쓰레기” “분리수거 잘해야 한다” 등의 원색적인 표현을 사용하며 맹비난했다.",與 “文치매 발언 오세훈은 극우”... 野 “쓰레기 막말 민주당은?”,김동하 기자,0.08467425265189377
"국민의당 안철수 대표가 공식 선거운동 첫날인 25일 국민의힘 유세차에 올라서 “목이 터지더라도 야권 단일후보 오세훈을 100번, 1000번이라도 외칠 것”이라고 했다. 안 대표는 합동유세에서 마주친 김종인 국민의힘 비상대책위원장과 손을 맞잡기도 했다. 이날 서울시청 광장에서 열린 국민의힘 거점유세장에 나온 안 대표는 품에서 연설문이 적힌 종이를 꺼내면서 “(문재인 정권에)험한 말이 나올까 봐 미리 적어왔다”고 했다. 선거법 위반 시비를 의식한 듯 옷차림은 유세점퍼가 아닌 회색정장 차림이었다. 안 대표는 “단일화 꼭 이뤄서 문재인 정권 심판하겠다는 약속을 지키기 위해서 이 자리에 섰다”면서 “시민 여러분의 투표 참여만이 썩은 권력, 무능하고 부도덕한 정부를 심판할 수 있다”고 했다. 이어 보궐선거를 야기한 박원순 전 서울시장의 성추행, 한국토지주택공사(LH) 투기 의혹도 거론하면서 “문재인 정권을 심판하려면 기호 2번 오세훈 후보를 찍어주셔야 한다”고 호소했다. 안 대표는 끓는 듯한 특유의 연설화법으로 “썩은 시정 끝장내고 서울을 바로잡을 사람, 정권교체 교두보 놓을 사람이 누굽니까”라고도 했다. 오 후보는 안 대표의 손을 치켜들면서 화답했다. 이날 유세장에는 단일화 과정에서 신경전을 벌여온 김종인 비상대책위원장도 함께 했다. 이보다 앞선 지원연설에 나선 김 위원장은 “오 후보는 시장에 취임하자마자 시정을 정상화 시킬 수 있는 유일한 후보”라며 “문재인 정부의 지난 4년 동안 모든 정책을 한 번에 평가해야 한다”고 했다. 연설이 끝난 뒤 안 대표가 연단으로 올라오면서 자연스럽게 마주친 두 사람은 악수했다. 이후 김 위원장은 안 대표의 연설이 시작되자 뒤에 서서 박수를 보내기도 했다. 김 위원장은 다음 일정인 언론사 인터뷰를 이유로 안 대표의 연설이 진행되는 도중 유세차에서 내려왔다. 이 때문에 오세훈·안철수·김종인 세 사람이 함께 하는 장면은 연출하지 못했다. 안 대표를 가장 반긴 것은 오 후보였다. 안 대표에 이어 마이크를 잡은 그는 “저와 안철수 대표가 손 잡고 서울시 탈환을 위해서 함께 뛰는 모습이 새 정치 아니겠느냐”며 "" 이런 새 정치로 서울시민들에게 새롭게 시작될 서울시정의 역사를 써나가겠다”고 했다.","오세훈 유세장서 만난 안철수와 김종인, 일단 손은 잡았다",김형원 기자,0.6678505841386247
"추미애 전 법무부 장관은 31일 국민의힘 오세훈 서울시장 후보와 박형준 부산시장 후보를 겨냥, “공정·정의와 거리가 먼 부당한 반칙과 편법으로 1% 특권층이 된 그들의 거짓에 휘둘리지 말아야 한다”고 했다. 추 전 장관은 이날 페이스북을 통해 “불공정한 방법으로 1% 특권층이 된 분들이 (서울·부산) 시장이 되면 과연 오로지 시민을 위한 공복이 될 수 있겠는가”라며 이같이 밝혔다. 추 전 장관은 “오 후보의 내곡동 토지 셀프보상 의혹은 점입가경”이라며 “측량을 도운 현지 임차인이 오 후보를 만난 사실에 대한 구체적 증언을 하는데도 (오 후보는) ‘땅도 모르고 현장에 가 보지도 않았다’고 하면서 정직하지 못한 태도로 방어하기에 급급하다”고 했다. 박 후보에 대해선 “(부산 해운대 초고층 주상복합 건물) 엘시티 특혜 의혹을 비롯한 가족의 부동산 투기 의혹이 꼬리에 꼬리를 물고 연달아 터지고 있다”고 했다. 추 전 장관은 “LH(한국토지주택공사) 사태로 인한 (국민의) 분노는 정당한 것. 무엇보다 막중한 책임을 느끼며 송구한 일”이라면서도 “그러나 (오 후보와 박 후보는) 민심의 분노에 편승해 마치 시장(직)이 부동산개발업자가 본업인 양 개발공약을 남발하고 있다”고 했다. 그러면서 “그들은 공정과 정의를 요구하는 촛불을 비웃으며 역사의 수레바퀴를 거꾸로 돌려놓으려 할 것”이라고 했다.","추미애 “LH 송구하나... 오세훈·박형준, 반칙으로 1% 특권층”",이세영 기자,0.3114205568797388
"국민의힘 오세훈 서울시장 후보가 2005년 내곡동 땅 측량 현장에 왔다가 생태탕 집에 들렀다고 주장한 식당 주인 황모씨가 나흘 만에 진술을 바꿔 논란이 일고 있다. 야당은 “제2의 김대업이냐” “생떼탕 끓이냐”고 했다. 서울 내곡동에서 생태탕 집을 운영했다는 황모씨는 지난 2일 TBS ‘김어준의 뉴스공장’에 출연해 “오 후보가 왔다. 기억한다. 잘생겨서 눈에 띄었다”며 오 후보가 내곡동 땅 측량 당시 자신의 식당에서 생태탕을 먹었다고 주장했다. 황씨의 아들도 인터뷰에서 “반듯하게 하얀 면바지에 신발은 캐주얼 단화를 신었다. 상당히 멋진 구두였다”며 구두 브랜드에 대해 “그게 페라가모”라고 했다. 하지만 황씨는 나흘 전인 지난달 29일 ‘일요시사’와의 전화 통화에서는 “오래전 일이라 기억이 안 난다”고 했던 사실이 4일 드러났다. 3일 공개된 음성 녹음에 따르면, 황씨는 “‘오세훈 시장입니다' 하고 저에게 인사한 적도 없고, 날 앉혀놓고 그런 얘기를 한 적도 없다”며 “주방에서만 일했기 때문에 신경을 안 썼다”고 했다. 이렇게 말한 지 나흘 만에 황씨와 아들은 오 후보의 옷차림까지 기억하며 생태탕 집에 왔다고 주장한 것이다. 이에 야당은 “제2의 김대업 만들기냐” “‘생떼탕' 끓이느냐”고 반발했다. 김대업씨는 지난 2002년 대선 당시 이회창 후보 장남이 돈을 주고 병역을 면제받았다는 의혹, 이른바 ‘병풍(兵風) 파문’을 일으켰다가 사기 혐의로 해외 도피 중 붙잡혔다. 오세훈 후보 캠프의 조수진 대변인은 “민주당과 박영선 후보, 김어준씨는 ‘생떼탕’ 끓이나”라며 “내곡동 생태탕이 맑은탕(일명 지리)이었는지, 매운탕이었는지 추가 폭로해 달라”고 했다. 국민의힘 박대출 의원은 “김대업으로 재미 본 추억이 아련한가”라며 “하다 하다 없었던 일을 사실처럼 만들고 싶었냐”고 했다. 하지만 민주당 박영선 서울시장 후보는 내곡동 ‘셀프 보상’ 의혹을 계속 제기했다. 박 후보 캠프의 강선우 대변인은 지난 2일 “오 후보, 생태탕은 맛있게 먹었나, 혼자 오리발탕 드신 것은 아닌가”라고 했다. 황씨는 2015년 가게를 폐업한 것으로 알려졌다. 본지는 황씨와의 통화를 시도했으나 연결이 되지 않았다.",생태탕집 주인 “오세훈 기억안나”… 나흘뒤 “구두까지 기억나”,이슬비 기자,0.17860177505204583
"국민의힘 오세훈 서울시장 후보는 29일 KBS 보도와 관련 “처남이 지난 2005년 당시 내곡동 토지 측량 신청자이자 현장 입회인으로서 입회 기록 공개 여부와 관련해 직접 한국 국토정보공사에 해당 ‘측량성과도 발급’을 신청할 예정”이라고 했다. 오 후보는 이날 YTN라디오 ‘황보선의 출발 새아침’ 인터뷰에서 “서류가 가장 정확하다. 그게 나오면 해명 끝날 거라 생각한다”며 이같이 말했다. 앞서 KBS는 오 후보가 지난 2005년 내곡동 땅 측량에 참여했고, 이로부터 9일 후에 서울도시주택공사가 조사설계 용역 계약서를 체결했다고 보도했다. 또 KBS에 따르면 당시 측량팀장은 “측량 현장에 오 후보가 나왔다”고 말했다고 한다. 이에 대해 오 후보는 “측량 현장에 제가 있었다 없었다가 중요한 게 아닌데 민주당에서 자꾸 프레임을 그쪽으로 옮겨간다. KBS를 통해 그런 작업하는 것으로 짐작한다”고 했다. 그러면서 “본질은 이 땅이 LH 투기처럼 정보를 알고 매입한 땅이 아니라, 장인 상속을 받은 땅이라는 게 중요하다”며 “또 보금자리주택지구로 선정되는 과정에서 오세훈이 시장으로서 영향을 행사했나, 그래서 돈 더 받았는지가 중요한데 영향력 행사 여지는 없다”고 했다. 처가땅 경작인이 당시 오 후보를 알아봤다는 방송보도에 대해서는 “당시 측량하게 된 이유가 처가 땅에 불법 경작을 한 분들을 내보내야 할 필요성 때문이었다”며 “그분이 무슨 이야기를 한들 무슨 의미가 있겠는가”라고 했다 또 “해명 과정에서 했던 이야기 중에 다른 게 나타나면 저를 거짓말쟁이로 몰고 싶어서 하는 것인데, 이 사건의 본질이 아니다”라고 했다. 국민의힘 서울시장 선거대책위 김예령 대변인은 이날 논평에서 “KBS는 초기 보도에는 내곡동 땅 특혜를 주장하더니 이와 관련한 증거가 나오지 않자, 오 후보가 땅의 존재여부를 알았는지 알지 못했는지에 대해 기사 방향을 무리하게 바꾸는 등 생트집을 잡고 있다”고 주장했다. 이어 “오늘 신청하는 측량성과도는 그 진실을 밝혀 줄 것”이라며 “문서의 결과조차 확인하지 않은 채, 악의적 보도로 오 후보에 대한 흑색선전에 앞장 선 KBS는 반드시 그 책임을 져야 할 것”이라고 했다.",오세훈 “측량참여? 오늘 정보공개청구…서류 나오면 해명 끝”,주형식 기자,0.14423945739099509
"더불어민주당은 23일 4·7 서울시장 보궐선거 야권(野圈) 단일 후보로 확정된 오세훈 국민의힘 후보를 향해 “‘셀프 탄핵’하며 서울시장직을 내팽개친 사람, 입만 열면 거짓말을 쏟아내는 사람”이라고 맹비난했다. 그러면서 “내곡동 특혜 의혹에 책임지고 사퇴하라”고 했다. 오 후보가 이날 오전 야권 단일 후보로 선출된 직후부터 당 차원에서 총공세에 나서는 모습이다. 박영선 민주당 서울시장 후보 캠프 강선우 대변인은 이날 논평을 내고 “‘사퇴왕 대 철수왕'의 대결에서 ‘사퇴왕’으로 단일화가 이뤄졌다”며 “서울시민을 따돌린 끼리끼리 ‘단일화 쇼’에 불과하다”고 했다. 강 대변인은 야권 단일화와 관련, “서로 머리채와 멱살을 잡고 ‘먼저 놓아라, 놓아주면 나도 놓겠다’라는 식의 유치한 싸움을 하느라, 감동도 없고 재미도 잃었을 뿐”이라며 “자리 나누기 식 억지 단일화로 대한민국 정당정치의 격만 떨어졌다. 승자는 없고 패자만 남은 그들만의 리그”라고 했다. 특히 오 후보를 향해 “스스로 ‘셀프 탄핵’하며 서울시장직을 내팽개친 사람, 입만 열면 거짓말을 쏟아내는 사람, 남은 1년의 서울시정을 정치투쟁에만 쏟을 사람, 서울시장은 그런 사람에게 어울리는 자리가 아니다”라고 했다. 강 대변인은 오 후보의 내곡동 땅 ‘셀프 보상’ 의혹과 관련해 “도돌이표 거짓말이 끝이 없다”며 “물은 셀프여도, 땅이 셀프여선 안 될 것”이라고 했다. 이어 “‘첫날부터 능숙하게’ 자기 잇속부터 챙길 후보에게 서울시를 맡길 수 없다”면서 “‘셀프 탄핵’했던 서울시장 시절 경험을 살려서 후보 사퇴부터 능숙하게 하라”고 했다. 박영선 후보 캠프 박성준 대변인도 이날 오 후보를 향해 “아이들 밥그릇은 차별하고 식구들의 보상금은 꼼꼼하게 챙겼다. ‘오세훈 게이트’의 진실을 밝힐 시간도 눈앞에 다가왔음을 잊지 말아야 할 것”이라고 했다. 신영대 민주당 중앙선대위 대변인은 “무상급식 반대를 위한 사퇴정치의 오세훈 후보”라며 “내곡동 투기 의혹에 대한 파렴치한 거짓말로 서울시민을 우롱해왔다”고 했다. 그러면서 “오 후보는 용산참사, 우면산 산사태, 세빛둥둥섬 세금낭비 등 서울시의 끔찍했던 악몽을 떠올리게 한다”며 “이명박 전 대통령처럼 13년 만에 법정에서 거짓말이 드러나는 전철을 밟고 싶은 것이 아니라면 내곡동 특혜 의혹에 대해 책임지고 사퇴 약속을 지켜야 할 것”이라고 했다. 신 대변인은 “비리로 얼룩진 오 후보에게 서울시민의 삶이나 도시 비전을 기대할 수 없다”고 했다.","민주당, 오세훈에 총공세 “셀프탄핵 거짓말쟁이, 사퇴하라”",안준용 기자,0.0913300001485671
