press,date,title,reporter,content
중앙일보,2021-04-06,"靑, 7일 최태원·김기문 만남···경제계 연쇄접촉 ""대통령 지시""",김은빈,"강민석 청와대 대변인. 청와대사진기자단 이호승 청와대 정책실장은 7일 최태원 대한상공회의소 회장, 김기문 중소기업중앙회장과의 만남을 시작으로 경제계와의 소통에 나선다. 강민석 청와대 대변인은 이날 오후 청와대 브리핑을 통해 ""청와대는 문재인 대통령 지시에 따라 내일부터 경제계 소통을 순차적으로 진행한다""고 밝혔다. 문재인 대통령이 지난 1일 내부 참모회의에서 ""경제계 인사들을 만나 고충을 들어주고 해결하고 기업활동을 뒷받침하는 것은 당연한 책무""라며 ""당당히 소통을 활성화 해달라""며 지시한 데 따른 것이다. 강 대변인에 따르면 이호승 정책실장은 7일 대한상의와 중소기업중앙회를 방문해 최태원 대한상의 회장과 김기문 중기중앙회장과 면담한다. 8일에는 경영자총연합회와 중견기업연합회를 찾는다. 또 14일에는 한국무엽협회를 방문한다. 강 대변인은 ""의제는 경제활력제고를 위한 민관 협력 방안 등이 될 것""이라며 ""한국판 뉴딜이나 탄소중립 이행 문제부터 규제 완화까지 다양한 논의가 이뤄질 것으로 기대한다""고 설명했다. 강 대변인은 ""청와대는 관이 주도하는 행사를 지양하고 경제단체를 직접 찾아서 생생한 현장 목소리 듣는 소통방식을 택했다. 안일환 경제수석과 이호준 산업정책비서관도 배석한다""며 ""일회성에 그치지 않도록 청와대는 경제단체 간담회 초청이 있을 때 적극적으로 참가해 소통을 이어갈 계획""이라고 말했다. 이번 경제계 소통에는 전국경제인연합회(전경련)는 포함되지 않았다. 청와대 핵심관계자는 ""(다른 일정과) 중복되는 거로 안다. 필요하면 소통할 것""이라며 ""대기업이든 중견기업이든 중소기업이든 앞으로 기업 애로를 듣고 해소방안을 함께 논의할 계획이다. 필요하면 각 기업과도 폭넓게 소통할 것""이라고 했다. 김은빈 기자kim.eunbin@joongang.co.kr"
중앙일보,2021-04-06,靑 찾아간 천안함 유족·함장…文대통령 면담 요청,김은빈,"최원일 전 천안함 함장(왼쪽부터), 안종민 천안함 전우회 사무총장, 고 이상희 하사 부친인 이성우 천안함 유족회장, 고 민평기 상사 형 광기 씨가 6일 천안함 재조사 논란과 관련 청와대를 항의 방문하고 있다. 연합뉴스 천안함 사건 유가족과 생존자 대표들이 6일 청와대를 방문해 문재인 대통령 면담을 요청했다. 천안함 전사자 고 이상희 하사의 부친인 이성우 천안함 유족회장과 고 민평기 상사의 형 민광기씨, 최원일 전 천안함장은 이날 오전 청와대 연풍관에서 청와대 시민사회수석실 행정관을 면담했다. 유족 측은 이 자리에서 문 대통령 면담과 진상규명위의 '천안함 재조사' 결정 경위에 대한 조사, 관계자 처벌 등을 요구했다. 앞서 규명위는 '천안함 좌초설'을 주장해온 신상철 전 민군합동조사단 조사위원의 진정으로 지난해 말 천안함 사건 장병들의 사망원인에 대한 조사 개시를 결정했다가 지난달 31일 이 같은 사실이 언론보도를 통해 알려져 논란이 되자 결정을 번복했다. 지난 2일 긴급회의 소집 후 '신씨가 관련 법령이 정한 진정인 요건에 해당하지 않는다'며 신씨의 진정을 각하한 것이다. 규명위 결정 번복에 결국 재조사는 취소됐지만 논란은 잦아들지 않고 있다. 일부 진상규명위원들로부터 '당시 천안함 관련 안건이 포함됐는지 몰랐다'는 말이 나오는가 하면, 신씨가 규명위에 제출한 진정서와 관련해 여러 의문도 제기되고 있다. 여기에 국방부도 지난해 규명위로부터 천안함 관련 조사 개시 결정문을 송달받고도 서욱 국방부 장관에겐 보고하지 않은 것으로 드러나 논란이 일었다. 이에 대해 부승찬 국방부 대변인은 이날 정례브리핑에서 ""(규명위 결정문이) 관련 부서가 아닌 다른 부서로 가는 바람에 세부내용을 확인하지 못한 부분이 있었다""고 재차 해명했다. 김은빈 기자kim.eunbin@joongang.co.kr"
중앙일보,2021-04-05,"문 대통령 ""경제 각종 지표들 확실한 회복의 길로…매우 다행""",김은빈,"문재인 대통령이 5일 청와대에서 열린 수석·보좌관 회의에서 발언하고 있다. 연합뉴스 문재인 대통령은 5일 ""경제에서는 각종 지표들이 확실한 회복의 길로 들어서고 있음을 보여주고 있다""고 말했다. 문 대통령은 이날 청와대 여민관에서 수석·보좌관회의(수보회의)를 주재하고 ""정부는 국가적 위기 속에서 방역과 경제의 두 마리 토끼를 잡기 위해 최선을 다해왔다""며 ""지표가 좋아졌다고 해서 국민의 삶이 당장 나아지는 것은 아니지만, 경제 반등의 흐름이 곳곳에서 만들어지고 있어 매우 다행이다""고 했다. 이어 ""2월 산업생산은 8개월 만에 최대 증가폭을 보이며 코로나 이전 수준을 회복한 것은 물론, 어려웠던 서비스업 생산도 크게 증가세를 보였다""며 ""수출 역시 3월 수출로는 역대 최고치를 기록하며 5개월 연속 증가했고, 15대 주력 품목 중 14개 품목이 증가해 코로나의 어려움을 떨쳐냈다""고 평가했다. 또 ""세계 1위 조선 강국의 위상을 압도적으로 되찾은 것은 물론, 혁신벤처와 신산업이 경제 반등의 든든한 밑거름이 되면서 우리 경제의 역동성과 미래 경쟁력을 보여주고 있는 것도 매우 큰 성과""라고 언급했다. 문 대통령은 ""경제 심리도 코로나 이전 수준을 넘어서며 지속적인 반등의 청신호가 되고 있다""며 ""기업경기실사지수도 제조업과 비제조업,대기업과 중소기업,수출기업과 내수기업,모두 오름세를 보이며 산업 전반에 회복의 온기가 돌고 있다""고 말했다. 문 대통령은 “무엇보다 지표로 나타나는 경제회복의 흐름을 국민들께서 실제 생활 속에서 체감할 수 있도록 최선을 다하겠다”며 “특히 일자리 회복에 최우선을 두면서 서민경제를 살리고 어려운 계층에 힘이 되는 포용적 회복에 정책역량을 집중하겠다”고 강조했다. 또 “기업들과 소통과 협력도 더욱 강화하겠다”며 “각 부처는 산업 현장의 애로를 적극적으로 해소하는 노력과 함께 기업활동 지원과 규제혁신에도 속도를 내어 경제 회복을 촉진하는 데 최선을 다해주기 바란다”고 당부했다. 백신 수급 문제와 관련해선 ""차질 없는 백신 도입으로 상반기1200만명 접종, 11월 집단면역의 목표를 달성하는 것은 물론 더 나아가 그 목표를 더 빠르게 달성하기 위해 총력을 다할 것""이라며 ""백신 수급에 차질이 없도록 범정부적으로 역량을 모아 전방위적 노력을 기울이겠다""고 밝혔다. 특히 문 대통령은 오는 7일 재보궐선거 본투표를 앞두고 ""선거 방역을 위해 빠짐없이 투표에 참여하면서도 방역 당국과 선관위의 방역 조치에 철저히 따라주시기 바란다""고 국민들에게 메시지를 냈다. 김은빈 기자kim.eunbin@joongang.co.kr"
중앙일보,2021-04-04,"문 대통령, ‘멘토’ 채현국 이사장 추모 “늘 그리울 것”",배재성,"제73주년 제주 4·3 희생자 추념식이 3일 오전 제주 4·3 평화교육센터에서 열렸다. 문재인 대통령이 추념식에 참석해 있다. 중앙포토 문재인 대통령은 4일 “‘시대의 어른’ 채현국 효암학원 이사장님의 발인을 앞두고 삼가 명복을 빈다”고 추모했다. 문 대통령은 이날 페이스북을 통해 이같이 밝히며 “진정한 자유인의 모습이 늘 그리울 것”이라고 적었다. 지난 2일 별세한 채 이사장은 2017년 더불어포럼 상임고문을 맡으며 문 대통령의 ‘멘토’로 불렸다. 더불어포럼은 문재인 당시 전 더불어민주당 대표를 지지하는 사회 각계 인사들이 모인 조직이다. 문 대통령은 채 이사장에 대해 “양산 지역에서 많은 인재를 배출한 개운중학교와 효암고등학교 운영에 모든 것을 쏟아붓고, 스스로는 무소유의 청빈한 삶을 사신 분”이라고 했다. 이어 “학교와 멀지 않은 제 양산 집에 오시기도 하면서 여러 번 뵐 기회가 있었는데, 연배를 뛰어넘어 막걸리 한잔의 대화가 언제나 즐거웠고, 늘 가르침이 됐다”고 말했다. 사진 SNS 캡처 그러면서 “지난 대선 후 전화로 인사를 드렸더니, 대통령 재임 중에는 전화도 하지 말자고 하셨던 것이 마지막 대화가 되고 말았다”며 “선생님이 보여주셨던 진정한 자유인의 모습이 늘 그리울 것”이라고 전했다. 배재성 기자 hongdoya@joongang.co.kr"
중앙일보,2021-04-04,"文대통령, 부활절 맞아 “고난의 역사를 희망의 역사로”",나운채,문재인 대통령 SNS(소셜네트워크서비스) 캡처 문재인 대통령이 4일 부활절을 맞아 “예수님의 부활처럼 우리 역시 ‘고난의 역사’를 ‘희망의 역사’로 바꿔 나갈 것”이라고 밝혔다. 문 대통령은 이날 자신의 소셜네트워크서비스(SNS)에 “예수님의 부활을 기쁘게 맞이하며 유례없는 위기 상황에서도 인내와 나눔으로 희망을 만들고 계신 국민들께 존경의 마음을 표한다”며 이같이 밝혔다. 또 “사랑과 은총을 전해 주시는 한국 교회 모든 분들께 깊이 감사드린다”고 전했다. 문 대통령은 “전 세계는 지금 ‘코로나(신종 코로나바이러스 감염증) 이후 어떻게 살 것인가’를 질문하고 있다”며 “우리는 그 물음에 대한 답을 실천하고 있다”고 글을 적었다. 이어 “혼자가 아니라 함께 자유롭고자 하는 우리 국민들의 마음은 코로나를 극복하고 포용적이며 지속가능한 세상을 만들어가는 동력이 되고 있다”고 강조했다. 그러면서 “함께 잘사는 나라를 위해 도전하면서 근원적인 곳에서부터 공정과 정의가 자리 잡도록 더욱 노력하겠다”며 “정직한 땀과 소박한 꿈이 존중받는 나라를 만들어나가겠다”고 밝혔다. 문 대통령은 끝으로 “예수님의 사랑과 축복이 온 가정에 가득하길 기원한다”고 덧붙였다. 나운채 기자 na.unchae@joongang.co.kr
